date,title,trail_text,source,section,url,query
2020-04-06,Sixth Dorothy Henderson Lodge resident dies from Covid-19 – as it happened,"Baptistcare confirms 90-year-old man dies after contracting the virus as total confirmed cases across Australia approaches 6,000. This blog is now closed",The Guardian,World news,https://www.theguardian.com/australia-news/live/2020/apr/06/australia-coronavirus-live-news-update-nsw-victoria-queensland-qld-ruby-princess-covid19-quarantine-latest-updates,"""Commonwealth Bank"""
2020-04-08,Parliament passes Covid-19 wage subsidy bill worth $130bn – as it happened,House of Representatives and Senate pass bill but Coalition blocks amendments to include more casual workers. This blog is now closed.,The Guardian,World news,https://www.theguardian.com/world/live/2020/apr/08/australia-coronavirus-live-updates-nsw-victoria-qld-parliament-jobkeeper-latest-news-update,"""Commonwealth Bank"""
2020-04-08,Coronavirus: contaminated money fears push Australia to card payments and cashless shopping,Digital payments soared in March as increasing number of shops refused to take cash or urged customers to tap-and-go ,The Guardian,Australia news,https://www.theguardian.com/australia-news/2020/apr/09/coronavirus-contaminated-money-fears-push-australia-to-card-payments-and-cashless-shopping,"""Commonwealth Bank"""
2020-04-21,Virgin Australia chief's revival plan faces intense turbulence,"If Paul Scurrah pulls off the turnaround, it will become one of the most famous victories in Australian corporate history",The Guardian,Business,https://www.theguardian.com/business/2020/apr/22/virgin-australia-chiefs-revival-plan-faces-intense-turbulence,"""Commonwealth Bank"""
2020-04-27,"Banks make it difficult and expensive to find cheap home loan rates, consumer watchdog finds",ACCC inquiry into big four banks found ‘maintaining profitability’ key factor in passing on RBA rate cuts<br>,The Guardian,Australia news,https://www.theguardian.com/australia-news/2020/apr/27/banks-make-it-difficult-and-expensive-to-find-cheap-home-loan-rates-consumer-watchdog-finds,"""Commonwealth Bank"""
2020-05-04,Westpac to withdraw support for thermal coalmining after 2030,Bank says climate change is a financial risk and addressing use of fossil fuels will create opportunities <br>,The Guardian,Australia news,https://www.theguardian.com/australia-news/2020/may/04/westpac-bank-to-withdraw-support-for-thermal-coal-mining-after-2030,"""Commonwealth Bank"""
2020-05-13,Worksafe to investigate cluster at Cedar Meats abattoir – as it happened,Queensland government to bid for Virgin airline; national death toll rises to 98; Josh Frydenberg tests negative to coronavirus. This blog is now closed,The Guardian,World news,https://www.theguardian.com/world/live/2020/may/13/australia-coronavirus-live-updates-nsw-victoria-qld-testing-latest-news-update,"""Commonwealth Bank"""
2020-05-13,Watchdog oversees $160m in payouts from Australian banks that sold junk insurance,"Eleven lenders are compensating more than 434,000 customers after selling them insurance they couldn’t use",The Guardian,Australia news,https://www.theguardian.com/australia-news/2020/may/14/watchdog-oversees-160m-in-payouts-from-australian-banks-that-sold-junk-insurance,"""Commonwealth Bank"""
2020-05-14,Australian households face grim financial outlook as coronavirus unemployment rises,Analysts say falling house prices and income losses will result in lower long-term rates of household consumption growth,The Guardian,Australia news,https://www.theguardian.com/australia-news/2020/may/15/australian-households-face-grim-financial-outlook-as-coronavirus-unemployment-rises,"""Commonwealth Bank"""
2020-05-15,How the coronavirus early access scheme has affected your superannuation fund,"Check the data to see how much has been withdrawn from your super fund, and how many members are accessing the scheme",The Guardian,Australia news,https://www.theguardian.com/australia-news/ng-interactive/2020/may/15/how-the-coronavirus-early-access-scheme-has-affected-your-superannuation-fund,"""Commonwealth Bank"""
2020-06-04,"Morning mail: Lancet retracts Covid-19 paper, Floyd memorial, walking with wombats","<strong>Friday: </strong>Paper that halted global trials of hydroxychloroquine because of fears of increased deaths is withdrawn. Plus, scheme to deliver food supplies to older Australians falls short",The Guardian,Australia news,https://www.theguardian.com/australia-news/2020/jun/05/morning-mail-lancet-retracts-covid-19-paper-floyd-memorial-walking-with-wombats,"""Commonwealth Bank"""
2020-06-09,Harm from drinking alcohol at home spikes in Australia amid coronavirus,Emergency medicine expert cites anecdotal evidence as new study finds people drinking more frequently during pandemic,The Guardian,Society,https://www.theguardian.com/society/2020/jun/10/harm-from-drinking-alcohol-at-home-spikes-in-australia-amid-coronavirus,"""Commonwealth Bank"""
2020-06-23,SA to further ease restrictions as Turnbull apologises for robodebt – as it happened,"Former PM says he is very sorry scheme has ‘created dismay and distress’, while Woolworths announces mass redundancies. This blog is now closed",The Guardian,Australia news,https://www.theguardian.com/australia-news/live/2020/jun/23/australia-coronavirus-news-victoria-hotspot-cluster-second-wave-borders-nsw-lockdown-moreland-brimbank-casey-darebin-hume-cardinia-qld-live-updates,"""Commonwealth Bank"""
2020-06-23,"Commonwealth Bank denies it faces billions in fines after alleged 390,000 breaches selling superannuation",Asic says CBA reaped $22m by pushing Essential Super through tellers and online,The Guardian,News,https://www.theguardian.com/news/2020/jun/23/commonwealth-bank-faces-billions-in-fines-after-alleged-390000-breaches-selling-superannuation,"""Commonwealth Bank"""
2020-06-24,'Virtually no demand' for coins in Covid-19 era as Australia's shift from cash to digital hastens,"As a result of the trend, the Royal Australian Mint and the Reserve Bank are considering producing less physical money",The Guardian,Business,https://www.theguardian.com/business/2020/jun/24/virtually-no-demand-for-coins-in-covid-19-era-as-australias-shift-from-cash-to-digital-hastens,"""Commonwealth Bank"""
2020-06-26,Commonwealth Bank activist shareholders call out company for financing new gas projects,Exclusive: Guy Abrahams wrote to CBA for clarity on how four recent investment decisions stack up against its own climate policies,The Guardian,News,https://www.theguardian.com/news/2020/jun/26/commonwealth-bank-activist-shareholders-call-out-company-for-financing-new-gas-projects,"""Commonwealth Bank"""
2020-06-30,'Big fat canary in the coalmine': Sydney Theatre Company strives to secure future,"‘We don’t know when we’re reopening and we don’t know how audiences will respond,’ executive director says",The Guardian,Culture,https://www.theguardian.com/stage/2020/jun/30/big-fat-canary-in-the-coalmine-sydney-theatre-company-strives-to-secure-future,"""Commonwealth Bank"""
2020-07-01,A whistle that never blew? How claim of leaking against Commonwealth Bank CEO was dropped,"Allegations by former Beem It app chief executive Angela Clark, in a workplace discrimination claim against that company, were withdrawn and the case discontinued",The Guardian,News,https://www.theguardian.com/news/2020/jul/01/a-whistle-that-never-blew-how-claim-of-leaking-against-commonwealth-bank-ceo-was-dropped,"""Commonwealth Bank"""
2020-07-03,"Westpac to repay $8m to 8,000 workers underpaid for long service leave","Bank joins long list of Australian companies, including Commonwealth Bank, who have underpaid staff",The Guardian,Australia news,https://www.theguardian.com/australia-news/2020/jul/03/westpac-to-repay-8m-to-8000-workers-underpaid-for-long-service-leave,"""Commonwealth Bank"""
2020-07-03,"UK service sector slump levels off, as China growth surges - as it happened",Rolling coverage of the latest economic and financial news ,The Guardian,Business,https://www.theguardian.com/business/live/2020/jul/03/china-services-companies-pmi-uk-eurozone-covid-recovery-business-live,"""Commonwealth Bank"""
2020-07-07,Australian banks say they will extend Covid-19 moratorium for some borrowers,Australian Banking Association says it will give some borrowers an additional four months pause on repayments ,The Guardian,Australia news,https://www.theguardian.com/australia-news/2020/jul/08/australian-banks-say-they-will-extend-covid-19-moratorium-for-some-borrowers,"""Commonwealth Bank"""
2020-07-07,Australian banks 'undermining Paris agreement' with $7bn in fossil fuel loans,"<strong>Exclusive:</strong> Australia’s big four banks have loaned $7bn to 33 new or expansionary fossil fuel projects between 2016 and 2019, analysis finds",The Guardian,Australia news,https://www.theguardian.com/australia-news/2020/jul/08/australian-banks-undermining-paris-agreement-with-7bn-in-fossil-fuel-loans,"""Commonwealth Bank"""
2020-07-08,147 new Australian Covid-19 cases – as it happened,Confusion over NSW-Victoria border closure as the state’s northern border closes for the first time in a century. This blog is now closed,The Guardian,Australia news,https://www.theguardian.com/australia-news/live/2020/jul/08/coronavirus-australia-update-live-news-nsw-victoria-border-exemption-melbourne-stage-3-lockdown-mitchell-second-wave-albury-wodonga,"""Commonwealth Bank"""
2020-07-16,Samsung investment in Adani's Australian coal operation prompts call for boycott,Activists protest at Samsung Electronics store in Sydney over debt purchase by affiliate Samsung Securities,The Guardian,Business,https://www.theguardian.com/business/2020/jul/16/samsung-investment-in-adanis-australian-coal-operation-prompts-call-for-boycott,"""Commonwealth Bank"""
2020-07-17,Westpac admits it has failed to fix culture that contributed to money-laundering scandal,"Bank pledged to address issues two years ago, but fresh review finds shortcomings persist ",The Guardian,Australia news,https://www.theguardian.com/australia-news/2020/jul/17/westpac-admits-it-has-failed-to-fix-culture-that-contributed-to-money-laundering-scandal,"""Commonwealth Bank"""
2020-07-20,Business groups welcome Coalition's expansion of Covid-19 loan scheme for small employers,Industry leaders have praised the decision that will allow businesses to access more credit for a longer period of time,The Guardian,Australia news,https://www.theguardian.com/australia-news/2020/jul/20/business-groups-welcome-coalitions-expansion-of-covid-19-loan-scheme-for-small-employers,"""Commonwealth Bank"""
2020-07-31,Safe as houses: hopes high that Australian property can avoid Covid-19 doomsday scenario,"‘It’s the bargain of the century’, says one agent, as ultra-low interest rates, rising savings and government support banish earlier fears of a crash",The Guardian,Australia news,https://www.theguardian.com/australia-news/2020/aug/01/safe-as-houses-hopes-high-that-australian-property-can-avoid-covid-19-doomsday-scenario,"""Commonwealth Bank"""
2020-08-12,Commonwealth Bank reports 11% profit fall but remains optimistic about Covid economic rebound,"CEO Matt Comyn says Australia is well positioned to navigate the coronavirus economic hit, but recovery would take longer than expected",The Guardian,Australia news,https://www.theguardian.com/australia-news/2020/aug/12/commonwealth-bank-reports-11-profit-fall-but-remains-optimistic-about-covid-economic-rebound,"""Commonwealth Bank"""
2020-08-12,Australia records its highest overnight coronavirus death toll as aged care continues to struggle – as it happened,NSW premier Gladys Berejiklian strongly encourages mask-wearing as Victoria’s hotel quarantine system goes under the microscope. This blog is now closed,The Guardian,Australia news,https://www.theguardian.com/australia-news/live/2020/aug/12/coronavirus-australia-latest-updates-victoria-covid-19-hotel-quarantine-nsw-gladys-berejiklian-new-zealand-tasmania-business-health-economy-live-news,"""Commonwealth Bank"""
2020-08-12,"Morning mail: airline price hikes investigated, Covid commission 'hijacked', the Muslim Game of Thrones","<strong>Thursday</strong>: Consumer watchdog examines claims that carriers are bumping passengers to sell first-class tickets. Plus, James Colley’s 10 funniest things",The Guardian,Australia news,https://www.theguardian.com/australia-news/2020/aug/13/morning-mail-airline-price-hikes-investigated-covid-commission-hijacked-the-muslim-game-of-thrones,"""Commonwealth Bank"""
2020-08-26,Victoria reports 149 new cases and 24 deaths as NSW records six infections – as it happened,Premier Daniel Andrews urges more Victorians to come forward for testing and Queensland reports one new case,The Guardian,Australia news,https://www.theguardian.com/australia-news/live/2020/aug/26/australia-coronavirus-live-update-sydney-quarantine-hotel-scott-morrison-qld-health-defence-latest-news,"""Commonwealth Bank"""
2020-08-27,Shane Warne's $1m baggy green finds permanent home next to Bradman,The dog-eared cap worn by the spinning great has landed at its new permanent home after a months-long tour of Australia,The Guardian,Sport,https://www.theguardian.com/sport/2020/aug/27/shane-warnes-1m-baggy-green-finds-permanent-home-next-to-bradman,"""Commonwealth Bank"""
2020-08-28,Adani quietly rebranding Abbot Point terminal as company hit with $107m damages bill,<strong>Exclusive: </strong>Queensland<strong> </strong>supreme court says company engaged in ‘unconscionable conduct’ ,The Guardian,Environment,https://www.theguardian.com/environment/2020/aug/28/adani-quietly-rebranding-abbot-point-terminal-as-company-hit-with-107m-damages-bill,"""Commonwealth Bank"""
2020-08-30,Unemployment spikes and household spending slumps under Victoria's stage 4 restrictions,Josh Frydenberg says Victorians need ‘message of hope’ as federal government urges states to reopen borders<br>,The Guardian,Australia news,https://www.theguardian.com/australia-news/2020/aug/31/unemployment-spikes-and-household-spending-slumps-under-victorias-stage-4-restrictions,"""Commonwealth Bank"""
2020-09-08,"Victorian jobs fell as those in rest of Australia made modest gains, payroll figures reveal","Bureau of Statistics figures come as the prime minister, Scott Morrison, talks down prospect of federal aid for Victoria",The Guardian,Business,https://www.theguardian.com/business/2020/sep/08/victorian-jobs-fell-as-those-in-rest-of-australia-made-modest-gains-payroll-figures-reveal,"""Commonwealth Bank"""
2020-09-12,The pandemic purse: services suffer while Australians spend up on home-cooking and liquor,"Over all Australians are spending less money, but analysts say the post-Covid states show this could quickly change<br>",The Guardian,Business,https://www.theguardian.com/business/2020/sep/13/the-pandemic-purse-services-suffer-while-australians-spend-up-on-home-cooking-and-liquor,"""Commonwealth Bank"""
2020-09-14,Investors that manage US$47tn demand world’s biggest polluters back plan for net-zero emissions,"Climate Action 100+ group put 161 fossil fuel, mining, transport and other big-emitting companies on notice in latest campaign by shareholders ",The Guardian,Environment,https://www.theguardian.com/environment/2020/sep/14/investors-worth-us47tn-demand-worlds-biggest-polluters-back-plan-for-net-zero-emissions,"""Commonwealth Bank"""
2020-09-15,Women are not financially illiterate. They need more than condescending advice,"Structural issues are the real drivers of women’s economic insecurity, but once again it appears to be women that need ‘fixing’<br>",The Guardian,Opinion,https://www.theguardian.com/commentisfree/2020/sep/16/women-are-not-financially-illiterate-they-need-more-than-condescending-advice,"""Commonwealth Bank"""
2020-09-16,New car sales in Australia slump but luxury brands buck trend during coronavirus pandemic,Overall sales have fallen 20% between January and August but Audi sales have actually increased,The Guardian,Australia news,https://www.theguardian.com/australia-news/2020/sep/16/new-car-sales-in-australia-slump-but-luxury-brands-buck-trend-during-coronavirus-pandemic,"""Commonwealth Bank"""
2020-09-23,Crown casino inquiry chair tells CEO money laundering allegations 'extraordinarily troubling',"‘This has reached debacle levels,’ the former judge heading the NSW inquiry tells Ken Barton as he gives evidence",The Guardian,Australia news,https://www.theguardian.com/australia-news/2020/sep/23/crown-casino-inquiry-chair-tells-ceo-money-laundering-allegations-extraordinarily-troubling,"""Commonwealth Bank"""
2020-10-02,John Alexander tells inquiry he doesn’t recall being briefed over $5.6m found in Crown casino cupboard when he was CEO,James Packer lieutenant agreed company’s strident defence to money laundering claims contained some inaccuracies,The Guardian,Australia news,https://www.theguardian.com/australia-news/2020/oct/02/john-alexander-tells-inquiry-he-doesnt-recall-being-briefed-over-56m-found-in-crown-casino-cupboard-when-he-was-ceo,"""Commonwealth Bank"""
2020-10-05,"Under the cover of Covid, Morrison wants to scrap my government's protections against predatory lending",The PM wants to repeal laws my government introduced to protect Australians – and the banks are popping champagne corks,The Guardian,Opinion,https://www.theguardian.com/commentisfree/2020/oct/05/kevin-rudd-under-the-cover-of-covid-morrison-wants-to-scrap-my-governments-predatory-lending-protections,"""Commonwealth Bank"""
2020-10-18,Crown Melbourne casino faces Austrac investigation for potential money laundering breaches,Company faces new threat to licences and prospect of multimillion-dollar fines,The Guardian,Australia news,https://www.theguardian.com/australia-news/2020/oct/19/crown-melbourne-casino-faces-austrac-investigation-for-potential-money-laundering-breaches,"""Commonwealth Bank"""
2020-10-28,It's not about the watches: is Australia Post a commercial operation or a public service?,"Amid the outrage over luxury watches, the broader point of what Australians want from the post office and how can it best be delivered is being ignored",The Guardian,Business,https://www.theguardian.com/business/2020/oct/29/its-not-about-the-watches-is-australia-post-a-commercial-operation-or-a-public-service,"""Commonwealth Bank"""
2020-10-29,Nationals call for ANZ boycott after bank's push for net zero emissions,Bank says it will stop lending to its largest customers unless businesses have carbon transition plans,The Guardian,Australia news,https://www.theguardian.com/australia-news/2020/oct/29/nationals-call-for-anz-boycott-after-banks-push-for-net-zero-emissions,"""Commonwealth Bank"""
2020-11-03,Cash rate cut to new historic low of 0.1% – as it happened,Trade tensions with China escalate; NSW on alert after restaurant worker at Jasmins1 in Liverpool tests positive for Covid. This blog is now closed,The Guardian,Australia news,https://www.theguardian.com/australia-news/live/2020/nov/03/trade-tensions-china-escalate-nsw-health-victoria-queensland-covid-19-live-news,"""Commonwealth Bank"""
2020-11-04,"NSW-Victoria border to reopen, as China trade fears grow – as it happened","‘We need to keep moving forward as we live with Covid-19,’ Gladys Berejiklian says. This blog is now closed",The Guardian,Australia news,https://www.theguardian.com/australia-news/live/2020/nov/04/integrity-commission-queensland-nsw-victoria-live-news,"""Commonwealth Bank"""
2020-11-09,ABC head defends Four Corners 'toxic culture' investigation before Senate estimates – politics live,David Anderson says program’s evidence ‘rock solid’; Asio chief warns of ‘real threat’ from foreign spies; incoming Biden administration vows to sign back up to Paris agreement. Follow all the updates,The Guardian,Australia news,https://www.theguardian.com/australia-news/live/2020/nov/09/australian-politics-live-coalition-feels-heat-over-emissions-policy-after-biden-win,"""Commonwealth Bank"""
2020-11-12,Regulator caves to pressure from Australian banks on executive bonuses,Apra had initially wanted a 50% cap on the amount of bonuses that come from financial performance and a delay of seven years in payment ,The Guardian,Australia news,https://www.theguardian.com/australia-news/2020/nov/12/regulator-caves-to-pressure-from-australian-banks-on-executive-bonuses,"""Commonwealth Bank"""
2020-11-14,Suing for climate action: can the courts save us from the black hole of political inaction?,Climate litigator David Barnden had a landmark win this month against a major superannuation fund. He tells Guardian Australia he is just getting started,The Guardian,Australia news,https://www.theguardian.com/australia-news/2020/nov/15/suing-for-climate-action-can-the-courts-save-us-from-the-black-hole-of-political-inaction,"""Commonwealth Bank"""
2020-11-22,UK lab-confirmed cases pass 1.5m – as it happened, This blog is now closed. We’ve launched a new blog at the link below: ,The Guardian,World news,https://www.theguardian.com/world/live/2020/nov/22/coronavirus-live-news-adelaide-emerges-from-lockdown-uk-records-341-more-deaths-g20-vaccine-pledge,"""Commonwealth Bank"""
2020-11-25,NSW government urges federal Coalition to double paid domestic violence leave,Mark Speakman says federal counterpart should follow NSW lead to grant 10 days’ leave to all employees,The Guardian,Australia news,https://www.theguardian.com/australia-news/2020/nov/26/nsw-government-urges-federal-coalition-to-double-paid-domestic-violence-leave,"""Commonwealth Bank"""
2020-12-08,Commonwealth Bank of Australia to move European HQ out of London,Relocation to Amsterdam will give better access to European markets ‘regardless of Brexit outcome’ ,The Guardian,News,https://www.theguardian.com/news/2020/dec/08/commonwealth-bank-australia-move-european-hq-london-amsterdam-brexit,"""Commonwealth Bank"""
2020-12-16,Liberal MPs pour cold water on inquiry backed by Frydenberg into bank lending for coal projects,Andrew Bragg and Tim Wilson say inquiry is unnecessary because it’s a legitimate ‘matter for those institutions’ ,The Guardian,Australia news,https://www.theguardian.com/australia-news/2020/dec/16/liberal-mps-pour-cold-water-on-inquiry-backed-by-frydenberg-into-bank-lending-for-coal-projects,"""Commonwealth Bank"""
2021-01-14,'Ridiculous' secrecy: confusion surrounds fate of $7m arts bailout money in $50m NSW government scheme,"<strong>Exclusive: </strong>Almost half the Rescue and Restart funds spent so far went to one company, while concerns remain about lack of transparency in other grant allocations",The Guardian,Culture,https://www.theguardian.com/culture/2021/jan/13/ridiculous-secrecy-7m-arts-bailout-money-formally-unaccounted-for-in-50m-nsw-government-scheme,"""Commonwealth Bank"""
2021-01-21,At least 500 to be hired for vaccine rollout – as it happened,Coronavirus restrictions to ease in Brisbane tomorrow; Scott Morrison rebukes Cricket Australia for dropping Australia Day reference. This blog is now closed,The Guardian,Australia news,https://www.theguardian.com/australia-news/live/2021/jan/21/coronavirus-tennis-dead-students-hecs-covid-19-nsw-queensland-australian-open-victoria,"""Commonwealth Bank"""
2021-01-22,"In the early days of Covid-19, we stopped consuming and rather loved it. But it didn't stick","In April of last year, Australians stopped spending – but where some label current highs in consumption as ‘recovery’, <strong>Sarah Wilson </strong>sees a cult",The Guardian,Life and style,https://www.theguardian.com/lifeandstyle/2021/jan/23/in-the-early-days-of-covid-19-we-stopped-consuming-and-rather-loved-it-but-it-didnt-stick,"""Commonwealth Bank"""
2021-02-10,South Australia responds to new hotel cases in Victoria – as it happened,Victoria backtracks on raising arrivals cap as hotel outbreak forces guests to be moved. This blog is now closed.,The Guardian,Australia news,https://www.theguardian.com/australia-news/live/2021/feb/10/australia-news-live-nsw-coronavirus-melbourne-holiday-inn-covid-vaccine-police,"""Commonwealth Bank"""
2021-02-11,Victoria records three new cases linked to hotel – as it happened,PM says hotel quarantine still ‘right way to go’ as South Australian border closes to Melbourne. This blog is now closed,The Guardian,Australia news,https://www.theguardian.com/australia-news/live/2021/feb/11/australia-news-live-sa-border-melbourne-peter-dutton-daniel-andrews-victoria-coronavirus-covid-19-holiday-inn-ppe-new-south-wales,"""Commonwealth Bank"""
2021-03-20,"'I don’t know how we’ll survive': city cafes, still deserted, brace for the end of jobkeeper","The treasurer says the next few weeks might be ‘bumpy’. For small businesses reliant on office workers, that’s an understatement ",The Guardian,Business,https://www.theguardian.com/business/2021/mar/21/i-dont-know-how-well-survive-city-cafes-still-deserted-brace-for-the-end-of-jobkeeper,"""Commonwealth Bank"""
2021-04-01,Qld ends lockdown after one new local case – as it happened,Queensland premier says noon lockdown finish allows Easter weekend travel to start; NSW reports no new local infections. This blog is now closed,The Guardian,Australia news,https://www.theguardian.com/australia-news/live/2021/apr/01/australia-news-live-easter-holidays-queensland-lockdown-bluesfest-2021-nsw-byron-bay,"""Commonwealth Bank"""
2021-04-21,Turkey sees record death toll – as it happened,Turkey currently ranks fourth globally in daily cases; England’s health department says contacts of confirmed case have been identified,The Guardian,World news,https://www.theguardian.com/world/live/2021/apr/21/coronavirus-live-news-india-reports-over-200000-cases-for-seventh-straight-day-japan-mulls-new-restrictions,"""Commonwealth Bank"""
