date,title,trail_text,source,section,url,query
2023-02-21,Australia needs a new plan to keep rural banks open before they all get turned into cafes,Financial services are essential to keeping regional areas alive but continuing bank closures are putting communities at risk,The Guardian,Australia news,https://www.theguardian.com/australia-news/2023/feb/21/australia-needs-a-new-plan-to-keep-rural-banks-open-before-they-all-get-turned-into-cafes,"""Commonwealth Bank"""
2023-02-21,MP gives first speech to parliament – as it happened,This blog is now closed,The Guardian,Australia news,https://www.theguardian.com/australia-news/live/2023/feb/21/australia-news-live-interest-rates-reserve-bank-poll-ndis-health-housing-economy-albanese-dutton-greens,"""Commonwealth Bank"""
2023-02-21,NSW police criticised for ‘outrageous’ midnight arrest of student who protested at RBA,"Cherish Kuehlmann woken up by officers who ‘barged into the house’ and took her to a police station, where she was charged with a trespass offence",The Guardian,Australia news,https://www.theguardian.com/australia-news/2023/feb/22/nsw-police-under-fire-for-outrageous-midnight-arrest-of-student-who-protested-at-rba,"""Commonwealth Bank"""
2023-02-21,Adani stock rout leaves tens of millions in Australian retirement savings exposed,Fraud allegations send Indian conglomerate’s share prices plunging but super funds contend exposure is limited due to diversification of holdings,The Guardian,Business,https://www.theguardian.com/business/2023/feb/22/adani-stock-rout-leaves-tens-of-millions-in-australian-retirement-savings-exposed,"""Commonwealth Bank"""
2023-02-22,O’Neil says migration system ‘broken’ – as it happened,This blog is now closed,The Guardian,Australia news,https://www.theguardian.com/australia-news/live/2023/feb/22/australia-news-live-anthony-albanese-defence-aukus-military-spies-asio-economy-interest-rates-energy-cost-of-living-health-weather-housing,"""Commonwealth Bank"""
2023-02-23,Afternoon Update: anger over Qantas’s record profit; Ivanka Trump and Jared Kushner subpoenaed; and Starbucks’ olive oil coffee,"Qantas the latest company to announce record profits, causing anger among some travellers and a Labor senator",The Guardian,Australia news,https://www.theguardian.com/australia-news/2023/feb/23/afternoon-update-anger-over-qantass-record-profit-ivanka-trump-and-jared-kushner-subpoenaed-and-starbucks-olive-oil-coffee,"""Commonwealth Bank"""
2023-02-23,"‘An economic fairytale’: Australia’s inflation being driven by company profits and not wages, analysis finds",Australia Institute warns of a ‘profit price spiral’ and calls for shift in RBA and government narrative towards corporations,The Guardian,Business,https://www.theguardian.com/business/2023/feb/24/an-economic-fairytale-australias-inflation-being-driven-by-company-profits-and-not-wages-analysis-finds,"""Commonwealth Bank"""
2023-02-24,Australia’s big banks are passing on all the interest rates hikes – but not the cuts,"While the banks have been quick to pass on RBA’s every cash rate increase, they have not matched all the decreases since June 2019",The Guardian,Australia news,https://www.theguardian.com/australia-news/datablog/2023/feb/25/australias-big-banks-are-passing-on-all-the-interest-rates-hikes-but-not-the-cuts,"""Commonwealth Bank"""
2023-02-28,"The Australian towns where the nearest bank branch is nearly 1,000km away","With nearly 100 regional branches either closed or soon to close, getting to the bank is becoming increasingly difficult for Australians in remote areas",The Guardian,Australia news,https://www.theguardian.com/australia-news/2023/mar/01/the-australian-towns-where-the-nearest-bank-branch-is-nearly-1000km-away,"""Commonwealth Bank"""
2023-03-01,Government says opposition leader’s Aukus comments ‘irresponsible’ – as it happened,This blog is now closed,The Guardian,Australia news,https://www.theguardian.com/australia-news/live/2023/mar/01/australia-live-news-politics-labor-coalition-infrastructure-nsw-perrottet-rajwinder-singh-cost-of-living-climate-transport-interest-inflation,"""Commonwealth Bank"""
2023-03-01,Australia bucking OECD trend with city dwellers still moving to the country,Latest statistics show migration from metro areas is still higher than pre-pandemic levels,The Guardian,Australia news,https://www.theguardian.com/australia-news/2023/mar/01/australia-bucking-oecd-trend-with-city-dwellers-still-moving-to-the-country,"""Commonwealth Bank"""
2023-03-05,Labor hits back at Coalition attacks on super changes – as it happened,This blog is now closed,The Guardian,Australia news,https://www.theguardian.com/australia-news/live/2023/mar/05/australia-news-live-anthony-albanese-chris-minns-nsw-election-angus-taylor-superannuation-worldpride,"""Commonwealth Bank"""
2023-03-07,Governor’s language shifts on future hikes – as it happened,This blog is now closed.,The Guardian,Australia news,https://www.theguardian.com/australia-news/live/2023/mar/07/australia-politics-live-albanese-labor-essential-poll-rba-cash-rate-superannuation-super-greens-safeguard-mechanism-carbon-climate-change,"""Commonwealth Bank"""
2023-03-08,Sydney trains delayed due to ‘communication issue’ – as it happened,This blog is now closed.,The Guardian,Australia news,https://www.theguardian.com/australia-news/live/2023/mar/08/australia-politics-live-international-womens-day-superannuation-interest-rates-rba-economy-health-housing-vic-qld-nsw,"""Commonwealth Bank"""
2023-03-09,‘Play nice’: big banks start to pass on RBA rate rise under the eye of ACCC inquiry,Latest hike is the first after a consumer watchdog investigation was launched into how banks set interest rates,The Guardian,Australia news,https://www.theguardian.com/australia-news/2023/mar/09/play-nice-big-banks-start-to-pass-on-rba-rate-rise-under-the-eye-of-accc-inquiry,"""Commonwealth Bank"""
2023-03-09,Robodebt inquiry analysis shows majority of victims women – as it happened,This blog is now closed.,The Guardian,Australia news,https://www.theguardian.com/australia-news/live/2023/mar/09/australia-politics-live-albanese-india-robodebt-voice-cost-of-living-climate-interest-rates-weather-health-nsw-qld-vic,"""Commonwealth Bank"""
2023-03-09,"India v Australia: fourth Test, day one – as it happened",An Usman Khawaja century and a breezy 49 from Cam Green puts Australia in the driving seat as India’s bowlers toil in the heat,The Guardian,Sport,https://www.theguardian.com/sport/live/2023/mar/09/india-vs-australia-live-updates-cricket-score-fourth-test-1st-day-one-ind-v-aus-scorecard-international-match-latest-scores-ahmedabad-narendra-modi-stadium,"""Commonwealth Bank"""
2023-03-10,Queensland mother whose son took his life calls for change at robodebt royal commission – As it happened,All the day’s news as it unfolded,The Guardian,Australia news,https://www.theguardian.com/australia-news/live/2023/mar/10/kevin-rudd-us-china-anthony-albanese-trade-talks-india-robodebt-hearings-bushfires-nsw-indigenous-rights-voice-interest-rates,"""Commonwealth Bank"""
2023-03-12,More rain across flooded Queensland region brings ‘extended peak’ – as it happened,This blog is now closed,The Guardian,Australia news,https://www.theguardian.com/australia-news/live/2023/mar/12/record-queensland-floods-burketown-evacuations-peak-anthony-albanese-aukus-meeting-submarines-economy-superannuation,"""Commonwealth Bank"""
2023-03-24,Australian banks predict another interest rate rise despite hopeful investor outlook,Big four banks believe RBA will lift cash rate by at least another 25 basis points though many predict rises are close to a peak,The Guardian,Business,https://www.theguardian.com/business/2023/mar/25/australian-banks-predict-another-interest-rate-rise-despite-hopeful-investor-outlook,"""Commonwealth Bank"""
2023-03-30,Shorten attacks Robert’s links to lobbyist – as it happened,This blog is now closed.,The Guardian,Australia news,https://www.theguardian.com/australia-news/live/2023/mar/30/australia-politics-live-unions-minimum-wage-indigenous-voice-job-vacancies-childcare-barack-obama-anthony-albanese-peter-dutton,"""Commonwealth Bank"""
2023-04-04,PM reportedly issued invitation to visit Beijing – as it happened,This blog is now closed.,The Guardian,Australia news,https://www.theguardian.com/australia-news/live/2023/apr/04/australia-news-live-tiktok-ban-reserve-bank-interest-rates-phillip-lowe-mortgage-stress-medicare-review,"""Commonwealth Bank"""
2023-04-05,"Australia’s booming banks should do more to protect customers from scams, advocates say","More than $95m has been lost to scams so far this year, while the big four are expected to make more than $33bn",The Guardian,Australia news,https://www.theguardian.com/australia-news/2023/apr/06/australias-booming-banks-should-do-more-to-protect-customers-from-scams-advocates-say,"""Commonwealth Bank"""
2023-04-06,Pat Dodson takes leave from Senate - as it happened,This blog is now closed.,The Guardian,Australia news,https://www.theguardian.com/australia-news/live/2023/apr/06/chris-minns-tiktok-ban-greens-legalisation-cannabis-voice-referendum-peter-dutton-anthony-albanese,"""Commonwealth Bank"""
2023-04-21,ABC thumbs its nose at News Corp and Acma with rerun of Fox and the Big Lie,Revamped Sarah Ferguson documentary to air on Four Corners after initial version sparked complaints. Plus: the Australian’s own goal,The Guardian,Media,https://www.theguardian.com/media/commentisfree/2023/apr/21/abc-thumbs-its-nose-at-news-corp-and-acma-with-rerun-of-fox-and-the-big-lie,"""Commonwealth Bank"""
2023-04-28,"One in five of Australia’s super funds is performing below benchmarks, analysis shows ",Watchdog’s analysis shows improvement on last year but 44% of so-called ‘choice funds’ are generating returns below expectations,The Guardian,Australia news,https://www.theguardian.com/australia-news/2023/apr/28/one-in-five-super-funds-is-performing-poorly-find-out-if-yours-is-among-them,"""Commonwealth Bank"""
2023-05-01,Calls to scrap referendum labelled ‘absurd’ – as it happened,This blog is now closed.,The Guardian,Australia news,https://www.theguardian.com/australia-news/live/2023/may/01/australia-news-live-indigenous-voice-cost-of-living-budget-economy-jobseeker-interest-rates,"""Commonwealth Bank"""
2023-05-01,"Australia’s big four banks may be at peak profitability but fat margins aren’t over, analysts say","Forecast to post a combined $16.2bn six-month profit, the big four are facing a looming plateau – but analysts expect strong earnings to continue",The Guardian,Australia news,https://www.theguardian.com/australia-news/2023/may/01/australias-big-four-banks-may-be-at-peak-profitability-but-fat-margins-arent-over-analysts-say,"""Commonwealth Bank"""
2023-05-07,Tasmania pushing to fast-track new AFL stadium; Chalmers slip hints at budget surplus – as it happened,This blog is now closed.,The Guardian,Australia news,https://www.theguardian.com/australia-news/live/2023/may/07/jim-chalmers-federal-budget-petroleum-resource-rent-tax-king-charles-coronation-reactions,"""Commonwealth Bank"""
2023-05-08,Commonwealth Bank says customers are feeling strain as it posts quarterly profit of $2.6bn,Australia’s biggest lender benefits from higher rates but warns that borrowers are under pressure from rising mortgage and living costs ,The Guardian,News,https://www.theguardian.com/news/2023/may/09/commonwealth-bank-says-customers-are-feeling-strain-as-it-posts-quarterly-profit-of-26bn,"""Commonwealth Bank"""
2023-05-09,"Inflation rate to halve, bringing wage growth by 2024, federal budget predicts – with hope of mortgage relief ",Australia’s economy remains resilient as global growth slows to its worst performance in more than two decades,The Guardian,Australia news,https://www.theguardian.com/australia-news/2023/may/09/inflation-rate-to-halve-bringing-wage-growth-by-2024-federal-budget-predicts-with-hope-of-mortgage-relief,"""Commonwealth Bank"""
2023-05-09,Treasurer delivers budget speech – as it happened,This blog is now closed.,The Guardian,Australia news,https://www.theguardian.com/australia-news/live/2023/may/09/budget-2023-live-updates-australia-federal-treasurer-jim-chalmers-speech-australian-government-anthony-albanese-labor-cost-of-living-latest-news,"""Commonwealth Bank"""
2023-05-10,PM maintains ‘we’re the party of aspiration’ – as it happened,This blog is now closed.,The Guardian,Australia news,https://www.theguardian.com/australia-news/live/2023/may/10/budget-2023-live-updates-reaction-cost-of-living-medicare-bulk-billing-treasurer-jim-chalmers-labor-anthony-albanese-coalition-peter-dutton-angus-taylor-latest-news,"""Commonwealth Bank"""
2023-05-11,"Westpac’s U-turn on rural bank branch closures a win for regional customers, Queensland MPs say","Decision to keep the Tully, Cloncurry and Ingham branches welcomed by local politicians, but they urge further reforms to ensure delivery of services in rural areas",The Guardian,Australia news,https://www.theguardian.com/australia-news/2023/may/11/westpacs-u-turn-on-rural-bank-branch-closures-a-win-for-regional-customers-queensland-mps-say,"""Commonwealth Bank"""
2023-05-11,Has Jim Chalmers’ budget really poured fuel on the inflation fire? Don’t believe the hype,Headlines stoked fears of ‘stimulatory’ measures but you only need to look at the big banks and markets to see the reception was calm,The Guardian,Australia news,https://www.theguardian.com/business/2023/may/11/has-jim-chalmers-really-poured-fuel-on-the-inflation-fire-dont-believe-the-hype,"""Commonwealth Bank"""
2023-05-17,"Young Australians cut non-essential items as over-35s keep spending, analysis finds","Expenditure by older cohort increased by almost double that of under-35s, while travel outlay grew 39% for all ages",The Guardian,Australia news,https://www.theguardian.com/australia-news/2023/may/17/young-australians-cut-non-essential-items-as-over-35s-keeps-spending-analysis-finds,"""Commonwealth Bank"""
2023-05-17,Collingwood’s Field of Dreams model fails with Magpies project unable to take flight,"Without its own unique location or a grassroots connection, the Super Netball expansion club faced challenges from the outset",The Guardian,Sport,https://www.theguardian.com/sport/blog/2023/may/17/collingwoods-field-of-dreams-model-fails-with-magpies-project-unable-to-take-flight,"""Commonwealth Bank"""
2023-05-18,"The Australian economy lost 27,100 full-time jobs in April as unemployment rose to 3.7%",UBS economist says jobs report ‘weaker than expected’ and makes an RBA rate hike in June ‘unlikely’,The Guardian,Australia news,https://www.theguardian.com/australia-news/2023/may/18/australian-economy,"""Commonwealth Bank"""
2023-05-29,"Australian banks lending billions to fossil fuel projects despite supporting emissions reductions, analysis suggests","Big four have pledged to align business practices with Paris agreement but loophole allows them to fund sector, activist group says",The Guardian,Australia news,https://www.theguardian.com/australia-news/2023/may/30/australian-banks-lending-billions-to-fossil-fuel-projects-despite-supporting-emissions-reductions-analysis-suggest,"""Commonwealth Bank"""
2023-06-06,"Central bank going ‘rogue’, senator claims – as it happened",This blog is now closed.,The Guardian,Australia news,https://www.theguardian.com/australia-news/live/2023/jun/06/australia-news-live-reserve-bank-rba-interest-rates-decision-kathleen-folbigg-lawyers,"""Commonwealth Bank"""
2023-06-06,Commonwealth Bank fined a record $3.55m for breaching spam laws with millions of emails,Australian Communications and Media Authority says bank sent 65m customer emails that breached Spam Act,The Guardian,News,https://www.theguardian.com/news/2023/jun/07/commonwealth-bank-fined-a-record-355m-for-breaching-spam-laws-with-millions-of-emails,"""Commonwealth Bank"""
2023-06-06,"Morning Mail: military ‘will be stronger’ for war crimes inquiry, Ukraine dam disaster, Harry in the stand","Defence chief says Brereton report will, in time, reap ‘positive effect’, Ukraine faces ecological crisis after dam collapse, Prince Harry takes to the witness stand",The Guardian,Australia news,https://www.theguardian.com/australia-news/2023/jun/07/morning-mail-military-will-be-stronger-for-war-crimes-inquiry-ukraine-dam-disaster-harry-in-the-stand,"""Commonwealth Bank"""
2023-06-09,"Inflation, unemployment, interest rate hikes: is it any wonder Australia’s misery index is rising?",Alleviate supermarket blues by performing a funky dance in the canned veg section,The Guardian,Opinion,https://www.theguardian.com/commentisfree/2023/jun/09/australia-misery-index-rising-growing-inflation-unemployment-interest-rate-hikes,"""Commonwealth Bank"""
2023-06-11,Quietest auction week since Easter – as it happened,This blog is now closed.,The Guardian,Australia news,https://www.theguardian.com/australia-news/live/2023/jun/11/australia-news-live-linda-burney-indigenous-voice-anika-wells-aged-care-anthony-albanese-peter-dutton-brittany-higgins-bruce-lehrmann,"""Commonwealth Bank"""
2023-06-14,Sydney CBD sees uptick in commuters as big banks lead push to return workers to offices,City train stations at 70% of pre-pandemic capacity amid warnings of potential effects of bringing workers back full-time,The Guardian,Australia news,https://www.theguardian.com/australia-news/2023/jun/14/sydney-cbd-sees-uptick-in-commuters-as-big-banks-lead-push-to-return-workers-to-offices,"""Commonwealth Bank"""
2023-06-14,Afternoon Update: Liberals break ranks over Higgins inquiry; Australian dead in Canadian wilderness; and a sullen Trump fronts court,Andrew Bragg labels debate in Senate as ‘very ugly’,The Guardian,Australia news,https://www.theguardian.com/australia-news/2023/jun/14/afternoon-update-liberals-break-ranks-over-higgins-inquiry-australian-dead-in-canadian-wilderness-and-a-sullen-trump-fronts-court,"""Commonwealth Bank"""
2023-06-17,A post-piggy bank world: what does money mean if you can’t hold it in your hand?,"Cheques are being phased out. Cash is on the decline. As we use cash less and less, how does this impact the way we think about and use money?",The Guardian,Australia news,https://www.theguardian.com/australia-news/2023/jun/18/a-post-piggy-bank-world-what-does-money-mean-if-you-cant-hold-it-in-your-hand,"""Commonwealth Bank"""
2023-06-26,Major Commonwealth Bank outage prevents some customers from accessing accounts,"CBA says issue resolved without reporting cause, but advises delay in some payments as services brought back online",The Guardian,News,https://www.theguardian.com/news/2023/jun/26/commbank-down-outage-commonwealth-bank-cba-netbank-online-banking-accounts,"""Commonwealth Bank"""
2023-06-26,Deputy PM says Russia uprising ‘a crack in the edifice’ – as it happened,This blog is now closed.,The Guardian,Australia news,https://www.theguardian.com/australia-news/live/2023/jun/26/australia-news-live-pwc-allegro-cost-of-living-jim-chalmers-indigenous-voice-anthony-albanese-peter-dutton-referendum-simon-crean-inflation,"""Commonwealth Bank"""
2023-06-27,PM launches byelection campaign – as it happened,This blog is now closed.,The Guardian,Australia news,https://www.theguardian.com/australia-news/live/2023/jun/27/australia-news-live-anthony-albanese-peter-dutton-indigenous-voice-to-parliament-poll-cost-of-living-taylor-swift,"""Commonwealth Bank"""
2023-07-09,Keating calls Nato head a ‘supreme fool’ over plan to open office in Asia – as it happened,This blog is now closed,The Guardian,Australia news,https://www.theguardian.com/australia-news/live/2023/jul/09/australia-news-live-trade-security-robodebt-indigenous-voice-cost-of-living,"""Commonwealth Bank"""
2023-07-10,"As Thames Water sinks, Macquarie Group continues its unstoppable rise ","The Australian operation has been widely blamed for the crisis at Britain’s biggest water company, but its profits – and its executives’ pay – show no sign of slowing",The Guardian,Business,https://www.theguardian.com/business/2023/jul/10/as-thames-water-sinks-macquarie-group-continues-its-unstoppable-rise,"""Commonwealth Bank"""
2023-07-12,Union challenges Commonwealth Bank rule that employees must spend half their hours a month in office,Finance Sector Union lodges dispute as mandate to limit working from home scheduled to come into effect 17 July,The Guardian,News,https://www.theguardian.com/news/2023/jul/12/commonwealth-bank-wfh-office-rule-union-dispute-work-from-home,"""Commonwealth Bank"""
2023-07-13,"Jo was scammed out of $4,000. She wants Australia’s banks to be responsible for paying it back","While banks resist calls to agree to a code for reimbursing money to fraud victims, consumer law advocates warn of the ‘outsized vulnerability of our citizens to scams’",The Guardian,Australia news,https://www.theguardian.com/australia-news/2023/jul/13/australia-scam-losses-repaid-bank-money,"""Commonwealth Bank"""
2023-07-13,Afternoon Update: Morrison ally faces possible Liberal expulsion; first home buyers slash spending; and the 10 highest-paid Australian CEOs,"Alex Hawke delayed preselections, harming party’s chances at 2022 election, a motion submitted to NSW Liberal state council claims",The Guardian,Australia news,https://www.theguardian.com/australia-news/2023/jul/13/afternoon-update-morrison-ally-faces-possible-liberal-expulsion-first-home-buyers-slash-spending-and-the-10-highest-paid-australian-ceos,"""Commonwealth Bank"""
2023-07-13,MP says byelections ‘very unpredictable’ – as it happened,This blog is now closed.,The Guardian,Australia news,https://www.theguardian.com/australia-news/live/2023/jul/13/australia-news-live-anthony-albanese-ukraine-president-volodymyr-zelenskiy-indigenous-voice-to-parliament-reserve-bank-robodebt-eu-trade-talks-fadden-byelection,"""Commonwealth Bank"""
2023-07-14,NAB offers staff 17.5% pay increase over four years to ease anger over return-to-office edicts,Union-negotiated deal the latest in the tussle between financial institutions and their employees over work-from-home arrangements and pay,The Guardian,Australia news,https://www.theguardian.com/australia-news/2023/jul/14/nab-staff-pay-increase-rise-17-percent-national-australia-bank,"""Commonwealth Bank"""
2023-07-14,Nationals accuse Labor of ‘hypocrisy’ over response to scathing APVMA report – as it happened,This blog is now closed,The Guardian,Australia news,https://www.theguardian.com/australia-news/live/2023/jul/14/australia-news-live-reserve-bank-rba-governor-philip-lowe-peter-dutton-indigenous-voice-cost-of-living-interest-rates,"""Commonwealth Bank"""
2023-07-14,"Qantas and Virgin duopoly dwarfs the Australian banking and supermarket industries, airport peak body says",Australian Airports Association tells parliamentary inquiry market dominance has allowed the two airlines to jack up profit margins,The Guardian,Business,https://www.theguardian.com/business/2023/jul/15/qantas-and-virgin-duopoly-dwarfs-the-australian-banking-and-supermarket-industries-airport-peak-body-says,"""Commonwealth Bank"""
2023-07-16,Hundreds charged after NSW domestic violence operation; South Australia moves to ban no cause evictions – as it happened,This blog is now closed.,The Guardian,Australia news,https://www.theguardian.com/australia-news/live/2023/jul/16/australia-news-live-updates-coalition-wins-fadden-byelection-gold-coast-peter-dutton-cost-of-living,"""Commonwealth Bank"""
2023-08-02,Labor not ruling out raising income-free area for jobseeker – as it happened,This blog is now closed,The Guardian,Australia news,https://www.theguardian.com/australia-news/live/2023/aug/02/australia-politics-live-unions-school-funding-housing-bill-anthony-albanese-peter-dutton-greens-labor-hanson-young-school-funding-climate-change,"""Commonwealth Bank"""
2023-08-03,Past and present public servants to be investigated – as it happened,This blog is now closed.,The Guardian,Australia news,https://www.theguardian.com/australia-news/live/2023/aug/03/australia-news-live-barrier-reef-carbon-capture-housing-bill-greens-anthony-albanese-indigenous-voice-to-parliament,"""Commonwealth Bank"""
2023-08-03,She escaped her husband’s physical violence – but economic ties kept them connected for years,"Dialogue around ‘coercive control’ in relation to financial abuse is gaining steam in the US, with California passing laws to protect victims from collectors",The Guardian,US news,https://www.theguardian.com/us-news/2023/aug/03/financial-abuse-domestic-violence-california-survivor-protections,"""Commonwealth Bank"""
2023-08-03,"NAB defends branch closures, says most customers use phone or online services","National Australia Bank stands in stark contrast to its peers, which put regional branch closures on hold in the wake of an inquiry",The Guardian,Australia news,https://www.theguardian.com/australia-news/2023/aug/04/nab-regional-branch-closures,"""Commonwealth Bank"""
2023-08-07,Zoom tells staff to come into the office at least two days a week,Policy to apply to those living within 50 miles and follows fall in post-pandemic demand for video-conferencing services,The Guardian,Technology,https://www.theguardian.com/technology/2023/aug/07/zoom-tells-staff-to-come-into-the-office-at-least-two-days-a-week,"""Commonwealth Bank"""
2023-08-08,Australia’s big banks squeeze new homeowners to maintain profits amid bad debt fears,"In an unusual turn of events, banks are raising mortgage rates for new customers to help cover expected losses from mortgage defaults",The Guardian,Business,https://www.theguardian.com/business/2023/aug/08/australias-big-banks-squeeze-new-homeowners-to-maintain-profits-amid-bad-debt-fears,"""Commonwealth Bank"""
